{
  "design_id": "sha256:f7a6845564f2d697fca9eac8bf9424136508a62c7fcc7851ad56c688dc2053f9",
  "entries": [
    {
      "canonical_command": "make -C npc/rv64 check-fdg-arch-trap",
      "closure_requirements": [
        "Bind the legal and illegal FP arch_trap focused matrix, program aggregate and compile-success RTL source mutation to the current design_id."
      ],
      "coverage": {
        "compile_success_rtl_mutation": true,
        "counterexample": true,
        "positive": true
      },
      "current_design_bound": true,
      "design_id": "sha256:f7a6845564f2d697fca9eac8bf9424136508a62c7fcc7851ad56c688dc2053f9",
      "evidence": [
        {
          "kind": "architecture_debt_current_receipt",
          "path": "npc/rv64/eval/ppa/evidence/architecture-debt-current.json",
          "sha256": "714674880a76ba00695984b84a802b65fd43e054d28269b18c24aa1efbb57c08"
        }
      ],
      "id": "FDG-G1",
      "owner_paths": [
        "npc/rv64/vsrc/frontend/OooFrontendDispatchGate.v",
        "npc/rv64/vsrc/frontend/OooFrontendBackendDispatchMux.v",
        "npc/rv64/vsrc/frontend/OooFrontend.v"
      ],
      "priority": "P0",
      "status": "CLOSED",
      "title": "arch_trap head0 must not present a backend operation"
    },
    {
      "canonical_command": "make -C npc/rv64 check-xret-current-mode",
      "closure_requirements": [
        "Rebind current-mode MRET/SRET legal and illegal program cases plus a compile-success RTL source mutation to the current design_id."
      ],
      "coverage": {
        "compile_success_rtl_mutation": true,
        "counterexample": true,
        "positive": true
      },
      "current_design_bound": true,
      "design_id": "sha256:f7a6845564f2d697fca9eac8bf9424136508a62c7fcc7851ad56c688dc2053f9",
      "evidence": [
        {
          "kind": "architecture_debt_current_receipt",
          "path": "npc/rv64/eval/ppa/evidence/architecture-debt-current.json",
          "sha256": "714674880a76ba00695984b84a802b65fd43e054d28269b18c24aa1efbb57c08"
        }
      ],
      "id": "XRET-G1",
      "owner_paths": [
        "npc/rv64/vsrc/frontend/OooFetchHeadClassifyGate.v",
        "npc/rv64/vsrc/control/OooPendingLane1CaptureGate.v",
        "npc/rv64/vsrc/control/OooPendingDispatchArbiter.v",
        "npc/rv64/vsrc/control/OooPendingTrapExitSequencer.v",
        "npc/rv64/vsrc/core/CsrFile.v",
        "npc/rv64/vsrc/control/OooCsrTrapRequestMux.v"
      ],
      "priority": "P0",
      "status": "CLOSED",
      "title": "MRET/SRET current-mode legality and precise trap"
    },
    {
      "canonical_command": "make -C npc/rv64 check-memory-issue-lifecycle",
      "closure_requirements": [
        "Bind atomic dual-memory capture, edge-old terminal ordering, owner-qualified request-fire/terminal-consume/MIQ-birth agreement, 15-field transaction identity, competing-owner arbitration, backpressure retention and exactly-once launch variants to the current design_id."
      ],
      "coverage": {
        "compile_success_rtl_mutation": true,
        "counterexample": true,
        "positive": true
      },
      "current_design_bound": true,
      "design_id": "sha256:f7a6845564f2d697fca9eac8bf9424136508a62c7fcc7851ad56c688dc2053f9",
      "evidence": [
        {
          "kind": "architecture_debt_current_receipt",
          "path": "npc/rv64/eval/ppa/evidence/architecture-debt-current.json",
          "sha256": "714674880a76ba00695984b84a802b65fd43e054d28269b18c24aa1efbb57c08"
        }
      ],
      "id": "MEM-ISSUE-G1",
      "owner_paths": [
        "npc/rv64/vsrc/execute/OooIntBackend.v",
        "npc/rv64/vsrc/memory/OooMemInflightQueue.v",
        "npc/rv64/vsrc/memory/OooStoreQueue.v"
      ],
      "priority": "P0",
      "status": "CLOSED",
      "title": "memory terminal consume, request fire and MIQ owner birth share one accepted transaction"
    },
    {
      "canonical_command": "/usr/bin/env -u MAKEFLAGS -u MFLAGS -u MAKELEVEL -u GNUMAKEFLAGS -u MAKEFILES /usr/bin/make -rR --no-print-directory -C npc/rv64 -f eval/ppa/ifu-evidence.mk check-ifu-axi-flush-drain",
      "closure_requirements": [
        "Bind the AW/W/B backpressure and flush-drain matrix plus source mutation to the current design_id."
      ],
      "coverage": {
        "compile_success_rtl_mutation": true,
        "counterexample": true,
        "positive": true
      },
      "current_design_bound": true,
      "design_id": "sha256:f7a6845564f2d697fca9eac8bf9424136508a62c7fcc7851ad56c688dc2053f9",
      "evidence": [
        {
          "kind": "architecture_debt_current_receipt",
          "path": "npc/rv64/eval/ppa/evidence/architecture-debt-current.json",
          "sha256": "714674880a76ba00695984b84a802b65fd43e054d28269b18c24aa1efbb57c08"
        }
      ],
      "id": "IFU-AXI-G1",
      "owner_paths": [
        "npc/rv64/vsrc/frontend/OooFetchAxiBridge.v",
        "npc/rv64/vsrc/bus/AxiCrossbar.v"
      ],
      "priority": "P0",
      "status": "CLOSED",
      "title": "A-update AW/W/B transport drains across frontend flush"
    },
    {
      "canonical_command": "make -C npc/rv64 check-ifu-fetch-provenance",
      "closure_requirements": [
        "Bind the page-end 16/32-bit second-page positive, poison and source-mutation cases to the current design_id."
      ],
      "coverage": {
        "compile_success_rtl_mutation": true,
        "counterexample": true,
        "positive": true
      },
      "current_design_bound": true,
      "design_id": "sha256:f7a6845564f2d697fca9eac8bf9424136508a62c7fcc7851ad56c688dc2053f9",
      "evidence": [
        {
          "kind": "architecture_debt_current_receipt",
          "path": "npc/rv64/eval/ppa/evidence/architecture-debt-current.json",
          "sha256": "714674880a76ba00695984b84a802b65fd43e054d28269b18c24aa1efbb57c08"
        }
      ],
      "id": "IFU-FETCH-G2",
      "owner_paths": [
        "npc/rv64/vsrc/frontend/OooFetchAxiBridge.v",
        "npc/rv64/vsrc/frontend/OooFetchPacketDecode.v"
      ],
      "priority": "P0",
      "status": "CLOSED",
      "title": "second-page fetch fault preserves fault-byte provenance"
    },
    {
      "canonical_command": "/usr/bin/env -u MAKEFLAGS -u MFLAGS -u MAKELEVEL -u GNUMAKEFLAGS -u MAKEFILES /usr/bin/make -rR --no-print-directory -C npc/rv64 -f eval/ppa/ifu-evidence.mk check-ifu-access",
      "closure_requirements": [
        "Bind F=0/2/4/6, exact 2B EXEC PMP, RRESP owner, PMEM tail bounds and lane1 owner counterexamples to the current design_id."
      ],
      "coverage": {
        "compile_success_rtl_mutation": true,
        "counterexample": true,
        "positive": true
      },
      "current_design_bound": true,
      "design_id": "sha256:f7a6845564f2d697fca9eac8bf9424136508a62c7fcc7851ad56c688dc2053f9",
      "evidence": [
        {
          "kind": "architecture_debt_current_receipt",
          "path": "npc/rv64/eval/ppa/evidence/architecture-debt-current.json",
          "sha256": "714674880a76ba00695984b84a802b65fd43e054d28269b18c24aa1efbb57c08"
        }
      ],
      "id": "IFU-ACCESS-G1",
      "owner_paths": [
        "npc/rv64/vsrc/frontend/OooFetchAxiBridge.v",
        "npc/rv64/vsrc/memory/PmpChecker.v",
        "npc/rv64/vsrc/bus/AxiCrossbar.v",
        "npc/rv64/vsrc/sim/AxiDpiSlave.sv",
        "npc/rv64/vsrc/frontend/OooFetchPacketDecode.v",
        "npc/rv64/vsrc/frontend/OooFetchHeadPairGate.v",
        "npc/rv64/vsrc/frontend/OooFrontendDispatchGate.v",
        "npc/rv64/vsrc/control/OooPendingLane1CaptureGate.v",
        "npc/rv64/vsrc/control/OooPendingDispatchArbiter.v",
        "npc/rv64/vsrc/control/OooPendingTrapExitSequencer.v",
        "npc/rv64/vsrc/control/OooStopPendingSequencer.v",
        "npc/rv64/vsrc/control/OooCsrTrapRequestMux.v"
      ],
      "priority": "P0",
      "status": "CLOSED",
      "title": "exact halfword execute footprint, PMP/RRESP and lane1 owner"
    },
    {
      "canonical_command": "make -C npc/rv64 check-ifu-tval",
      "closure_requirements": [
        "Bind offset 2/4/6, compressed-control, dispatch backpressure and exact joint PC/cause/tval lifecycle evidence plus source variants to the current design_id."
      ],
      "coverage": {
        "compile_success_rtl_mutation": true,
        "counterexample": true,
        "positive": true
      },
      "current_design_bound": true,
      "design_id": "sha256:f7a6845564f2d697fca9eac8bf9424136508a62c7fcc7851ad56c688dc2053f9",
      "evidence": [
        {
          "kind": "architecture_debt_current_receipt",
          "path": "npc/rv64/eval/ppa/evidence/architecture-debt-current.json",
          "sha256": "714674880a76ba00695984b84a802b65fd43e054d28269b18c24aa1efbb57c08"
        }
      ],
      "id": "IFU-TVAL-G1",
      "owner_paths": [
        "npc/rv64/vsrc/frontend/OooFetchPacketDecode.v",
        "npc/rv64/vsrc/frontend/OooFetchPacketFifo.v",
        "npc/rv64/vsrc/frontend/OooFrontend.v",
        "npc/rv64/vsrc/frontend/OooFetchHeadPairGate.v",
        "npc/rv64/vsrc/frontend/OooFrontendDispatchGate.v",
        "npc/rv64/vsrc/control/OooPendingLane1CaptureGate.v",
        "npc/rv64/vsrc/control/OooPendingDispatchArbiter.v",
        "npc/rv64/vsrc/control/OooPendingTrapExitSequencer.v",
        "npc/rv64/vsrc/control/OooStopPendingSequencer.v",
        "npc/rv64/vsrc/control/OooCsrTrapRequestMux.v"
      ],
      "priority": "P0",
      "status": "CLOSED",
      "title": "instruction fault tval identifies the faulting byte portion"
    },
    {
      "canonical_command": "make -C npc/rv64 check-ptw-pmp",
      "closure_requirements": [
        "Bind PTE WRITE deny/allow and deny-with-no-AW/W counterexamples plus source mutation to the current design_id."
      ],
      "coverage": {
        "compile_success_rtl_mutation": true,
        "counterexample": true,
        "positive": true
      },
      "current_design_bound": true,
      "design_id": "sha256:f7a6845564f2d697fca9eac8bf9424136508a62c7fcc7851ad56c688dc2053f9",
      "evidence": [